authors,title,average_rating
Reza Aslan,Zealot: The Life and Times of Jesus of Nazareth,4.0
Terry Goodkind,"Soul of the Fire (Sword of Truth, #5)",4.0
"Jan-Philipp Sendker, Kevin Wiliarty",The Art of Hearing Heartbeats,4.0
Iain M. Banks,"Consider Phlebas (Culture, #1)",4.0
David J. Schwartz,The Magic of Thinking Big,4.0
Anne Rice,"The Vampire Armand (The Vampire Chronicles, #6)",4.0
Abbi Glines,"Forever Too Far (Rosemary Beach, #3; Too Far, #3)",4.0
George R.R. Martin,"A Storm of Swords: Steel and Snow (A Song of Ice and Fire, #3: Part 1 of 2)",4.0
"Carlo Collodi, John Boyne, Monteiro Lobato, Unknown",Pinocchio,4.0
Robin LaFevers,"Grave Mercy (His Fair Assassin, #1)",4.0
Henry Miller,Tropic of Cancer,4.0
Wally Lamb,The Hour I First Believed,4.0
Brian Sibley,Harry Potter: Film Wizardry,4.0
"Leo Tolstoy, Aylmer Maude",The Death of Ivan Ilych,4.0
Paula McLain,Circling the Sun,4.0
John Steinbeck,Travels with Charley: In Search of America,4.0
Alice Hoffman,The Dovekeepers,4.0
Scott Lynch,"The Republic of Thieves (Gentleman Bastard, #3)",4.0
Cornelia Funke,The Thief Lord,4.0
Susan Ee,"World After (Penryn & the End of Days, #2)",4.0
Dean Koontz,"Brother Odd (Odd Thomas, #3)",4.0
John Howard Griffin,Black Like Me,4.0
Chuck Palahniuk,Snuff,3.0
James Patterson,"Jack & Jill (Alex Cross, #3)",4.0
Ian McEwan,Saturday,4.0
Jonathan Kellerman,"When the Bough Breaks (Alex Delaware, #1)",4.0
Robert James Waller,The Bridges of Madison County,4.0
Lee Child,"Gone Tomorrow (Jack Reacher, #13)",4.0
Michael Scott,"The Sorceress (The Secrets of the Immortal Nicholas Flamel, #3)",4.0
Hilary Mantel,"Bring Up the Bodies (Thomas Cromwell, #2)",4.0
Rick Riordan,"The Maze of Bones  (The 39 Clues, #1)",4.0
Mark Bittman,How to Cook Everything: Simple Recipes for Great Food,4.0
Stephenie Meyer,"The Twilight Collection (Twilight, #1-3)",4.0
Wassily Kandinsky,Concerning the Spiritual in Art,4.0
Winston Groom,"Forrest Gump (Forrest Gump, #1)",4.0
"Albert Camus, Justin O'Brien",The Fall,4.0
Tom Robbins,Even Cowgirls Get the Blues,4.0
"Wilkie Collins, Carolyn G. Heilbrun",The Moonstone,4.0
"Italo Calvino, William Weaver",If on a Winter's Night a Traveler,4.0
"Gregory Maguire, Douglas Smith","Son of a Witch (The Wicked Years, #2)",3.0
Ian McEwan,On Chesil Beach,4.0
Patricia MacLachlan,"Sarah, Plain and Tall (Sarah, Plain and Tall, #1)",4.0
Christopher Moore,"Bloodsucking Fiends (A Love Story, #1)",4.0
"David Sedaris, Ian Falconer",Squirrel Seeks Chipmunk: A Modest Bestiary,3.0
Brené Brown,The Gifts of Imperfection: Let Go of Who You Think You're Supposed to Be and Embrace Who You Are,4.0
Ann Patchett,Commonwealth,4.0
Melissa de la Cruz,"The Van Alen Legacy (Blue Bloods, #4)",4.0
Robert McCloskey,Blueberries for Sal,4.0
Colleen Hoover,"Losing Hope (Hopeless, #2)",4.0
Stephen King,Lisey's Story,4.0
Eben Alexander,Proof of Heaven: A Neurosurgeon's Journey into the Afterlife,4.0
Terry Pratchett,"Men at Arms (Discworld, #15; City Watch #2)",4.0
A.J. Jacobs,The Year of Living Biblically: One Man's Humble Quest to Follow the Bible as Literally as Possible,4.0
Frank Herbert,God Emperor of Dune (Dune Chronicles #4),4.0
Emily Giffin,The One & Only,3.0
Jean M. Auel,"The Valley of Horses (Earth's Children, #2)",4.0
Harlan Coben,Six Years,4.0
Katherine Dunn,Geek Love,4.0
"Sophocles, Dudley Fitts, Elena Bono, Robert Fitzgerald","The Oedipus Cycle: Oedipus Rex/Oedipus at Colonus/Antigone (The Theban Plays, #1–3)",4.0
Robert Penn Warren,All the King's Men,4.0
Ann Brashares,"Girls in Pants: The Third Summer of the Sisterhood (Sisterhood, #3)",4.0
Harlan Coben,The Woods,4.0
Robert Jordan,"New Spring (Wheel of Time, #0)",4.0
John Grisham,The Litigators,4.0
"Fredrik Backman, Henning Koch",My Grandmother Asked Me to Tell You She's Sorry,4.0
Vince Flynn,"American Assassin (Mitch Rapp, #1)",4.0
Hannah Kent,Burial Rites,4.0
Sarah Waters,Fingersmith,4.0
Peter Mayle,A Year in Provence,4.0
"Kate DiCamillo, Bagram Ibatoulline",The Miraculous Journey of Edward Tulane,4.0
Jojo Moyes,The Last Letter from Your Lover,4.0
Martin Cruz Smith,"Gorky Park (Arkady Renko, #1)",4.0
Tara Conklin,The House Girl,4.0
Meg Cabot,"Queen of Babble (Queen of Babble, #1)",4.0
Jeff Kinney,"The Third Wheel (Diary of a Wimpy Kid, #7)",4.0
Elizabeth Wein,"Code Name Verity (Code Name Verity, #1)",4.0
Ellen Hopkins,"Burned (Burned, #1)",4.0
Sidney Sheldon,Master of the Game,4.0
Patricia Cornwell,"The Body Farm (Kay Scarpetta, #5)",4.0
Meg Cabot,"The Boy Next Door (Boy, #1)",4.0
"Anonymous, N.K. Sandars",The Epic of Gilgamesh,4.0
Anna Godbersen,"The Luxe (Luxe, #1)",4.0
Philip Roth,"American Pastoral (The American Trilogy, #1)",4.0
Elizabeth Gilbert,Big Magic: Creative Living Beyond Fear,4.0
Jim Butcher,"Skin Game (The Dresden Files, #15)",5.0
Gena Showalter,The Darkest Night (Lords of the Underworld #1),4.0
Neal Stephenson,Anathem,4.0
Barbara Kingsolver,The Lacuna,4.0
Terry Pratchett,"Hogfather (Discworld, #20; Death, #4)",4.0
Elizabeth Berg,Open House,4.0
Jeannette Walls,The Silver Star,4.0
John Irving,The Hotel New Hampshire,4.0
Laurell K. Hamilton,"The Laughing Corpse (Anita Blake, Vampire Hunter, #2)",4.0
Nora Roberts,"Key of Light (Key Trilogy, #1)",4.0
Ellen Hopkins,Identical,4.0
"Janet Evanovich, Lorelei King","Smokin' Seventeen (Stephanie Plum, #17)",4.0
Dr. Seuss,The Sneetches and Other Stories,4.0
"Bill Martin Jr., Eric Carle","Polar Bear, Polar Bear, What Do You Hear?",4.0
Kurt Vonnegut Jr.,"God Bless You, Mr. Rosewater",4.0
"Yoshiki Nakamura, Tomo Kimura","Skip Beat!, Vol. 01",4.0
Frank Miller,Batman: The Dark Knight Returns #1,4.0
"J.K. Rowling, Mary GrandPré","The Harry Potter Collection 1-4 (Harry Potter, #1-4)",5.0
Paolo Bacigalupi,The Windup Girl,4.0
"Oscar Wilde, Richard Allen Cave",The Importance of Being Earnest and Other Plays,4.0
Stephanie Perkins,"Isla and the Happily Ever After (Anna and the French Kiss, #3)",4.0
Ilona Andrews,"Magic Bites (Kate Daniels, #1)",4.0
Jodi Ellen Malpas,"This Man Confessed (This Man, #3)",4.0
Terry Pratchett,"Sourcery (Discworld, #5; Rincewind #3)",4.0
"Grant Morrison, Dave McKean",Batman: Arkham Asylum - A Serious House on Serious Earth,4.0
Jenny Han,"P.S. I Still Love You (To All the Boys I've Loved Before, #2)",4.0
David Baldacci,"Memory Man (Amos Decker, #1)",4.0
Hillary Jordan,Mudbound,4.0
Mark Bowden,Black Hawk Down,4.0
"V.E. Schwab, Victoria Schwab","A Darker Shade of Magic (Shades of Magic, #1)",4.0
David Grann,The Lost City of Z: A Tale of Deadly Obsession in the Amazon,4.0
Brandon Sanderson,"Firefight (The Reckoners, #2)",4.0
Trudi Canavan,"The Magicians' Guild (Black Magician Trilogy, #1)",4.0
Michael Scott,"The Necromancer  (The Secrets of the Immortal Nicholas Flamel, #4)",4.0
Lee Child,"61 Hours (Jack Reacher, #14)",4.0
Patricia McCormick,Cut,4.0
"Roald Dahl, Quentin Blake",George's Marvellous Medicine,4.0
Jane Smiley,A Thousand Acres,4.0
Lloyd Alexander,"The Book of Three (The Chronicles of Prydain, #1)",4.0
Patricia Briggs,"Cry Wolf (Alpha & Omega, #1)",4.0
Ian Falconer,Olivia,4.0
Kent Haruf,"Plainsong (Plainsong, #1)",4.0
Daniel Clowes,Ghost World,4.0
Amanda Hocking,"Torn (Trylle, #2)",4.0
"Ivan Turgenev, George Reavy, Jane Costlow",Fathers and Sons,4.0
"Eliyahu M. Goldratt, Jeff Cox",The Goal: A Process of Ongoing Improvement,4.0
Geraldine Brooks,Caleb's Crossing,4.0
Claudia Gray,"Evernight (Evernight, #1)",4.0
Lee Child,"Bad Luck and Trouble (Jack Reacher, #11)",4.0
Karen Joy Fowler,The Jane Austen Book Club,3.0
Ian McEwan,The Children Act,4.0
Janet Evanovich,"Sizzling Sixteen (Stephanie Plum, #16)",4.0
Ashlee Vance,Elon Musk: Inventing the Future,4.0
James S.A. Corey,"Caliban's War (The Expanse, #2)",4.0
Rebecca Donovan,"Barely Breathing (Breathing, #2)",4.0
"Homer, Robert Fagles, Bernard Knox",The Iliad/The Odyssey,4.0
"Mark Waid, Alex Ross, Elliot S. Maggin",Kingdom Come,4.0
Sarah Waters,Tipping the Velvet,4.0
"Chris Colfer, Brandon Dorman","The Wishing Spell (The Land of Stories, #1)",4.0
David Ebershoff,The 19th Wife,4.0
Walter Dean Myers,Monster,4.0
George R.R. Martin,"A Song of Ice and Fire (A Song of Ice and Fire, #1-4)",5.0
Patricia Cornwell,"Body of Evidence (Kay Scarpetta, #2)",4.0
"Brian K. Vaughan, Fiona Staples",Saga #1,4.0
Sara Shepard,"Perfect (Pretty Little Liars, #3)",4.0
Jessica Sorensen,"The Secret of Ella and Micha (The Secret, #1)",4.0
Kevin Hearne,"Hounded (The Iron Druid Chronicles, #1)",4.0
Stephen King,From a Buick 8,3.0
Kim Stanley Robinson,"Red Mars (Mars Trilogy, #1)",4.0
"Charlotte Perkins Gilman, Elaine Hedges",The Yellow Wall-Paper,4.0
Nora Roberts,"Sea Swept (Chesapeake Bay Saga, #1)",4.0
Brent Weeks,"The Blinding Knife (Lightbringer, #2)",4.0
Morgan Matson,Since You've Been Gone,4.0
Steve Martin,An Object of Beauty,4.0
John Flanagan,"The Icebound Land (Ranger's Apprentice, #3)",4.0
"Peter Thiel, Blake  Masters","Zero to One: Notes on Startups, or How to Build the Future",4.0
Sarah J. Maas,"Empire of Storms (Throne of Glass, #5)",5.0
Gillian Flynn,The Grownup,4.0
Neil Gaiman,Smoke and Mirrors: Short Fiction and Illusions,4.0
Amish Tripathi,"The Oath of the Vayuputras (Shiva Trilogy, #3)",4.0
Kurt Vonnegut Jr.,Welcome to the Monkey House,4.0
David McCullough,Truman,4.0
Ron Chernow,Alexander Hamilton,4.0
"Nikolai Gogol, Robert A. Maguire",Dead Souls,4.0
Elle Kennedy,"The Deal (Off-Campus, #1)",4.0
Kiera Cass,"The Crown (The Selection, #5)",4.0
David Baldacci,"Zero Day (John Puller, #1)",4.0
L.J. Smith,"Night World, No. 1 (Night World, #1-3)",4.0
Tina Reber,"Love Unscripted (Love, #1)",4.0
James Patterson,"Pop Goes the Weasel (Alex Cross, #5)",4.0
Alison Weir,The Six Wives of Henry VIII,4.0
"Yevgeny Zamyatin, Clarence Brown",We,4.0
Barbara Kingsolver,Pigs in Heaven,4.0
Alan Paton,"Cry, the Beloved Country",4.0
Gregory Maguire,Confessions of an Ugly Stepsister,4.0
Cassandra Clare,"Lady Midnight (The Dark Artifices, #1)",4.0
Cornelia Funke,"Inkdeath (Inkworld, #3)",4.0
Isaac Asimov,Foundation's Edge (Foundation #4),4.0
Thomas Hardy,Jude the Obscure,4.0
David Eddings,"Queen of Sorcery (The Belgariad, #2)",4.0
Shirley Jackson,The Lottery and Other Stories,4.0
Margaret Peterson Haddix,"Into the Gauntlet (The 39 Clues, #10)",4.0
Aprilynne Pike,"Wings (Wings, #1)",4.0
Cecily von Ziegesar,"Gossip Girl (Gossip Girl, #1)",4.0
Frederick Forsyth,The Odessa File,4.0
Elizabeth Strout,The Burgess Boys,4.0
Yuval Noah Harari,Sapiens: A Brief History of Humankind,4.0
"Chelsea Handler, Johnny Kansas, Stephanie Stehling, Heather McDonald, Roy Handler, Brad Wollack, Amber Mazzola, Josh Wolf, Shoshanna Handler, Eva Magdalenski, Amy Meyer, Glen Handler, Dave Mallow, Sarah Colonna",Lies That Chelsea Handler Told Me,4.0
Tana French,"Broken Harbour (Dublin Murder Squad, #4)",4.0
M. Leighton,"Down to You (The Bad Boys, #1)",4.0
William Shakespeare,The Complete Works,4.0
Ursula K. Le Guin,The Dispossessed,4.0
"Henning Mankell, Steven T. Murray","Faceless Killers (Kurt Wallander, #1)",4.0
John Grisham,The Confession,4.0
Dean Koontz,Lightning,4.0
Judy Blume,"Superfudge (Fudge, #3)",4.0
Shari Lapena,The Couple Next Door,4.0
Cynthia Hand,"Hallowed (Unearthly, #2)",4.0
Ann Leckie,Ancillary Justice (Imperial Radch #1),4.0
"James C. Collins, Jerry I. Porras",Built to Last: Successful Habits of Visionary Companies,4.0
Eric Wilson,Fireproof,4.0
Laurell K. Hamilton,"The Lunatic Cafe (Anita Blake, Vampire Hunter #4)",4.0
David Wong,"John Dies at the End (John Dies at the End, #1)",4.0
"Carl Sagan, Ann Druyan",The Demon-Haunted World: Science as a Candle in the Dark,4.0
Lucy Christopher,Stolen: A Letter to My Captor,4.0
Stanisław Lem,Solaris,4.0
Elizabeth Wurtzel,Prozac Nation,4.0
Lloyd Alexander,The Black Cauldron (The Chronicles of Prydain #2),4.0
Mitch Albom,The First Phone Call from Heaven,4.0
Augusten Burroughs,Possible Side Effects,4.0
Anna Quindlen,Still Life with Bread Crumbs,4.0
Agatha Christie,"The A.B.C. Murders (Hercule Poirot, #13)",4.0
Anonymous,Holy Bible: New International Version,5.0
J.R. Ward,"Lover Reborn (Black Dagger Brotherhood, #10)",4.0
Julia Quinn,"The Duke and I (Bridgertons, #1)",4.0
"Margaret Weis, Tracy Hickman","Dragons of Spring Dawning (Dragonlance: Chronicles, #3)",4.0
Richard K. Morgan,"Altered Carbon (Takeshi Kovacs, #1)",4.0
A.J. Banner,The Good Neighbor,3.0
"Brian K. Vaughan, Fiona Staples","Saga, Vol. 2 (Saga, #2)",5.0
Lee Child,"The Enemy (Jack Reacher, #8)",4.0
Michael   Lewis,Flash Boys: A Wall Street Revolt,4.0
"Jean-Dominique Bauby, Jeremy Leggatt",The Diving Bell and the Butterfly,4.0
"Bill O'Reilly, Martin Dugard",Killing Kennedy: The End of Camelot,4.0
Chevy Stevens,Still Missing,4.0
Frank McCourt,"'Tis (Frank McCourt, #2)",4.0
Charles C. Mann,1491: New Revelations of the Americas Before Columbus,4.0
Marissa Meyer,"Fairest (The Lunar Chronicles, #3.5)",4.0
Kay Redfield Jamison,An Unquiet Mind: A Memoir of Moods and Madness,4.0
Edward Albee,Who's Afraid of Virginia Woolf?,4.0
Andrzej Sapkowski,"The Last Wish (The Witcher, #1)",4.0
"Umberto Eco, William Weaver",Foucault's Pendulum,4.0
Don Freeman,A Pocket for Corduroy,4.0
Jacqueline Carey,"Kushiel's Dart (Phèdre's Trilogy, #1)",4.0
Eric Metaxas,"Bonhoeffer: Pastor, Martyr, Prophet, Spy",4.0
Janet Evanovich,"Explosive Eighteen (Stephanie Plum, #18)",4.0
Michael  Grant,"Lies (Gone, #3)",4.0
Julie Kagawa,"The Iron Knight (The Iron Fey, #4)",4.0
Jacqueline Winspear,"Maisie Dobbs (Maisie Dobbs, #1)",4.0
Raymond E. Feist,"Magician (The Riftwar Saga, #1-2)",4.0
Ann Brashares,"Forever in Blue: The Fourth Summer of the Sisterhood (Sisterhood, #4)",4.0
"Stieg Larsson, Reg Keeland","The Millennium Trilogy (Millennium Trilogy, #1-3)",4.0
Dot Hutchison,The Butterfly Garden (The Collector #1),4.0
Jeaniene Frost,"Destined for an Early Grave (Night Huntress, #4)",4.0
R.K. Lilley,"In Flight (Up in the Air, #1)",4.0
James Patterson,"Cross (Alex Cross, #12)",4.0
Meg Cabot,"All-American Girl (All-American Girl, #1)",4.0
Bill Bryson,Neither Here nor There: Travels in Europe,4.0
David Levithan,Boy Meets Boy,4.0
Wally Lamb,We Are Water,4.0
James Patterson,"Max (Maximum Ride, #5)",4.0
Alexandra Adornetto,"Halo (Halo, #1)",4.0
Kiran Desai,The Inheritance of Loss,3.0
"Johann Wolfgang von Goethe, Burton Pike",The Sorrows of Young Werther,4.0
Jeaniene Frost,"At Grave's End (Night Huntress, #3)",4.0
Alexandra Fuller,Don't Let's Go to the Dogs Tonight,4.0
Robin McKinley,Beauty: A Retelling of the Story of Beauty and the Beast,4.0
Jonathan Safran Foer,Eating Animals,4.0
"Angie Sage, Mark Zug","Flyte (Septimus Heap, #2)",4.0
Rae Carson,"The Girl of Fire and Thorns (Fire and Thorns, #1)",4.0
Ann Aguirre,"Enclave (Razorland, #1)",4.0
"Dava Sobel, Neil Armstrong",Longitude: The True Story of a Lone Genius Who Solved the Greatest Scientific Problem of His Time,4.0
"Johann Wolfgang von Goethe, Peter Salm",Faust: First Part,4.0
James W. Loewen,Lies My Teacher Told Me,4.0
"Joe Hill, Gabriel Rodríguez","Locke & Key, Vol. 1: Welcome to Lovecraft",4.0
Patrick Ness,"The Ask and the Answer (Chaos Walking, #2)",4.0
Alexandra Ripley,Scarlett,3.0
Laurell K. Hamilton,"Bloody Bones (Anita Blake, Vampire Hunter #5)",4.0
F. Scott Fitzgerald,This Side of Paradise,4.0
Blaine Harden,Escape from Camp 14: One Man's Remarkable Odyssey from North Korea to Freedom in the West,4.0
Kim Harrison,"Every Which Way But Dead (The Hollows, #3)",4.0
Curtis Sittenfeld,"Eligible: A Modern Retelling of Pride and Prejudice (The Austen Project, #4)",4.0
"J.R.R. Tolkien, Christopher Tolkien, Alan Lee",The Children of Húrin,4.0
"Richard Atwater, Florence Atwater, Robert Lawson",Mr. Popper's Penguins,4.0
Lev Grossman,"The Magician's Land (The Magicians, #3)",4.0
William Faulkner,Light in August,4.0
"E.B. White, Fred Marcellino",The Trumpet of the Swan,4.0
George Saunders,Tenth of December,4.0
Sherrilyn Kenyon,"Night Pleasures (Dark-Hunter, #1)",4.0
"Thomas J. Stanley, William D. Danko",The Millionaire Next Door: The Surprising Secrets of Americas Wealthy,4.0
Ally Carter,"Don't Judge a Girl by Her Cover (Gallagher Girls, #3)",4.0
Bob Dylan,"Chronicles, Vol. 1",4.0
Bill Bryson,The Lost Continent: Travels in Small Town America,4.0
Sidney Sheldon,Tell Me Your Dreams,4.0
Iain M. Banks,"The Player of Games (Culture, #2)",4.0
"George Selden, Garth Williams",The Cricket in Times Square,4.0
Patrick Lencioni,The Five Dysfunctions of a Team: A Leadership Fable,4.0
"William S. Burroughs, Oliver  Harris, Allen Ginsberg",Junky,4.0
"Roger Fisher, William Ury, Bruce Patton",Getting to Yes: Negotiating an Agreement Without Giving In,4.0
Colleen Hoover,November 9,4.0
Kerry Lonsdale,"Everything We Keep (Everything We Keep, #1)",4.0
Samantha Towle,"The Mighty Storm (The Storm, #1)",4.0
Madeline Miller,The Song of Achilles,4.0
Amy Schumer,The Girl with the Lower Back Tattoo,4.0
"Krishna-Dwaipayana Vyasa, Simon Brodbeck, Juan Mascaró",The Bhagavad Gita,4.0
"Paul Auster, Art Spiegelman",The New York Trilogy,4.0
Pam Muñoz Ryan,Esperanza Rising,4.0
J.D. Salinger,"Raise High the Roof Beam, Carpenters & Seymour: An Introduction",4.0
Laurell K. Hamilton,"The Killing Dance (Anita Blake, Vampire Hunter, #6)",4.0
"Friedrich Nietzsche, R.J. Hollingdale, Michael Tanner",Beyond Good and Evil,4.0
Christopher Paul Curtis,The Watsons Go to Birmingham - 1963,4.0
Julie Kagawa,"The Immortal Rules (Blood of Eden, #1)",4.0
Dave Cullen,Columbine,4.0
Anne Rice,"Lasher (Lives of the Mayfair Witches, #2)",4.0
Laila Ibrahim,Yellow Crocus,4.0
"Mark Owen, Kevin Maurer",No Easy Day: The Firsthand Account of the Mission That Killed Osama Bin Laden,4.0
Laura Moriarty,The Chaperone,4.0
Patricia Cornwell,"All That Remains (Kay Scarpetta, #3)",4.0
"Richard Bachman, Stephen King",The Regulators,4.0
"Neil Gaiman, Matt Wagner, George Pratt, Dick Giordano, Kelley Jones, P. Craig Russell, Mike Dringenberg, Malcolm Jones III, Todd Klein, Harlan Ellison",Season of Mists (The Sandman #4),5.0
"James Patterson, Andrew Gross",Judge & Jury,4.0
Jennifer L. Armentrout,"Origin (Lux, #4)",4.0
"Kami Garcia, Margaret Stohl","Beautiful Redemption (Caster Chronicles, #4)",4.0
Kate Morton,The Distant Hours,4.0
David Sheff,Beautiful Boy: A Father's Journey Through His Son's Addiction,4.0
Abbi Glines,"The Vincent Boys (The Vincent Boys, #1)",4.0
Edgar Allan Poe,The Cask of Amontillado,4.0
"Ovid, David Raeburn, Denis Feeney",Metamorphoses,4.0
Julia Alvarez,In the Time of the Butterflies,4.0
Robert Morgan,Gap Creek,4.0
Jennifer L. Armentrout,"Half-Blood (Covenant, #1)",4.0
"Bo Hampton, Tracey Hampton, Washington Irving",The Legend of Sleepy Hollow (Graphic Novel),4.0
Jen Lancaster,"Bitter Is the New Black: Confessions of a Condescending, Egomaniacal, Self-Centered Smartass, Or, Why You Should Never Carry A Prada Bag to the Unemployment Office",4.0
Karin Slaughter,"Blindsighted (Grant County, #1)",4.0
Wallace Stegner,Angle of Repose,4.0
Brian Jacques,"Lord Brocktree (Redwall, #13)",4.0
Elin Hilderbrand,Barefoot,4.0
Tennessee Williams,Cat on a Hot Tin Roof,4.0
James Patterson,"The Final Warning (Maximum Ride, #4)",4.0
Robin Hobb,"Golden Fool (Tawny Man, #2)",4.0
David Baldacci,"Split Second (Sean King & Michelle Maxwell, #1)",4.0
Michael Connelly,"The Fifth Witness (Mickey Haller, #5; Harry Bosch Universe, #20)",4.0
Tad Williams,"The Dragonbone Chair (Memory, Sorrow, and Thorn, #1)",4.0
Jan Karon,"At Home in Mitford (Mitford Years, #1)",4.0
Anthony Horowitz,"Scorpia (Alex Rider, #5)",4.0
Erika Johansen,"The Queen of the Tearling (The Queen of the Tearling, #1)",4.0
Gordon Korman,"One False Note (The 39 Clues, #2)",4.0
Holly Black,"Tithe (Modern Faerie Tales, #1)",4.0
Lee Child,"Echo Burning (Jack Reacher, #5)",4.0
L.J. Smith,"The Fury / Dark Reunion (The Vampire Diaries, #3-4)",4.0
"Colleen Hoover, Tarryn Fisher","Never Never (Never Never, #1)",4.0
Elizabeth Haynes,Into the Darkest Corner,4.0
James Patterson,"Roses are Red (Alex Cross, #6)",4.0
James Rollins,"Map of Bones (Sigma Force, #2)",4.0
Harlan Coben,The Stranger,4.0
Sara Shepard,"Unbelievable (Pretty Little Liars, #4)",4.0
"E.M. Forster, Oliver Stallybrass, Pankaj Mishra",A Passage to India,4.0
Rachel Hartman,"Seraphina (Seraphina, #1)",4.0
Nora Roberts,"Morrigan's Cross (Circle Trilogy, #1)",4.0
Jean M. Auel,"The Mammoth Hunters (Earth's Children, #3)",4.0
Jim Butcher,"Princeps' Fury (Codex Alera, #5)",4.0
Kevin Henkes,Chrysanthemum,4.0
Wendy Higgins,"Sweet Evil (Sweet, #1)",4.0
Herman Wouk,"The Winds of War (The Henry Family, #1)",4.0
"Stephen King, Jae Lee","The Wind Through the Keyhole (The Dark Tower, #4.5)",4.0
Bernard Cornwell,"The Last Kingdom (The Saxon Stories, #1)",4.0
"James Howe, Deborah Howe, Alan Daniel","Bunnicula (Bunnicula, #1)",4.0
R.A. Salvatore,"Exile (Forgotten Realms: The Dark Elf Trilogy, #2; Legend of Drizzt, #2)",4.0
Amanda Hocking,"Ascend (Trylle, #3)",4.0
"Jussi Adler-Olsen, Lisa Hartford","The Keeper of Lost Causes (Department Q, #1)",4.0
Gabriel García Márquez,Of Love and Other Demons,4.0
Rick Riordan,The Demigod Files (Percy Jackson and the Olympians),4.0
Oliver Sacks,Musicophilia: Tales of Music and the Brain,4.0
Stephen King,"End of Watch (Bill Hodges Trilogy, #3)",4.0
Christopher Moore,Fool,4.0
John Connolly,The Book of Lost Things,4.0
Bill Clinton,My Life,4.0
"Frank Miller, Lynn Varley",300,4.0
Linda Sue Park,"Storm Warning (The 39 Clues, #9)",4.0
Ally Carter,"Only the Good Spy Young (Gallagher Girls, #4)",4.0
Lee Child,"Persuader (Jack Reacher, #7)",4.0
Charlaine Harris,"Grave Sight (Harper Connelly, #1)",4.0
Nora Roberts,"Blood Brothers (Sign of Seven, #1)",4.0
"Nobuhiro Watsuki, Kenichiro Yagi","Rurouni Kenshin, Vol. 1: Meiji Swordsman Romantic Story (Rurouni Kenshin, #1)",4.0
Miranda Kenneally,Catching Jordan,4.0
Joe Simpson,Touching the Void: The True Story of One Man's Miraculous Survival,4.0
Colleen Hoover,"This Girl (Slammed, #3)",4.0
Dan Millman,Way of the Peaceful Warrior: A Book That Changes Lives,4.0
Salman Rushdie,The Satanic Verses,4.0
Barbara Demick,Nothing to Envy: Ordinary Lives in North Korea,4.0
Gail McHugh,"Collide (Collide, #1)",4.0
Jonah Lehrer,How We Decide,4.0
Laurie R. King,"The Beekeeper's Apprentice (Mary Russell, #1)",4.0
"Jean de Brunhoff, Merle S. Haas",The Story of Babar,4.0
Michael Scott,"The Warlock (The Secrets of the Immortal Nicholas Flamel, #5)",4.0
Jim Butcher,"First Lord's Fury (Codex Alera, #6)",4.0
Tom Rachman,The Imperfectionists,4.0
Katja Millay,The Sea of Tranquility,4.0
"Marjane Satrapi, Anjali Singh","Persepolis 2: The Story of a Return (Persepolis, #2)",4.0
Terry Pratchett,"Pyramids (Discworld, #7)",4.0
Jenny Downham,Before I Die,4.0
Elizabeth Gilbert,Committed: A Skeptic Makes Peace with Marriage,3.0
Sarah Dessen,Keeping the Moon,4.0
Veronica Roth,"The Transfer (Divergent, #0.1)",4.0
Terry Goodkind,"Chainfire (Sword of Truth, #9)",4.0
"Julia Child, Simone Beck, Louisette Bertholle",Mastering the Art of French Cooking,4.0
"Kazue Kato, John Werry","Blue Exorcist, Vol. 1  (Blue Exorcist, #1)",4.0
Terry Goodkind,"Confessor (Sword of Truth, #11)",4.0
Mohsin Hamid,The Reluctant Fundamentalist,4.0
Jennifer A. Nielsen,The False Prince (The Ascendance Trilogy #1),4.0
John Updike,"Rabbit, Run (Rabbit Angstrom #1)",4.0
Daniel Todd Gilbert,Stumbling on Happiness,4.0
T.S. Eliot,The Waste Land and Other Poems,4.0
"Else Holmelund Minarik, Maurice Sendak",Little Bear,4.0
Edgar Allan Poe,The Pit and the Pendulum,4.0
Terry Pratchett,"Lords and Ladies (Discworld, #14; Witches #4)",4.0
Terry Pratchett,"Thud! (Discworld, #34; City Watch #7)",4.0
Naomi Novik,"His Majesty's Dragon (Temeraire, #1)",4.0
"Holly Black, Tony DiTerlizzi","The Field Guide (The Spiderwick Chronicles, #1)",4.0
David Platt,Radical: Taking Back Your Faith from the American Dream,4.0
Jean Craighead George,"My Side of the Mountain (Mountain, #1)",4.0
"Susanna Kearsley, Rosalyn Landor","The Winter Sea (Slains, #1)",4.0
Peter Lerangis,"The Sword Thief (The 39 Clues, #3)",4.0
Robin Cook,Coma,4.0
"Hubert Selby Jr., Darren Aronofsky, Richard Price",Requiem for a Dream,4.0
Erin Hunter,"Into the Wild (Warriors, #1)",4.0
Maya Banks,"Rush (Breathless, #1)",4.0
"Ian Edginton, Oscar Wilde, I.N.J. Culbard",The Picture of Dorian Gray: A Graphic Novel,4.0
Robert McCammon,Swan Song,4.0
Kazuo Ishiguro,The Buried Giant,3.0
China Miéville,"Perdido Street Station (Bas-Lag, #1)",4.0
Carrie Jones,"Need (Need, #1)",4.0
Terry Pratchett,"Witches Abroad (Discworld, #12; Witches #3)",4.0
"Geoffrey Crayon, Washington Irving, William L. Hedges",The Legend of Sleepy Hollow and Other Stories,4.0
Frank Herbert,Heretics of Dune (Dune Chronicles #5),4.0
Jim Butcher,"Captain's Fury (Codex Alera, #4)",4.0
Chuck Palahniuk,"Damned (Damned, #1)",3.0
Karen Russell,Swamplandia!,3.0
Michael Connelly,"The Last Coyote (Harry Bosch, #4; Harry Bosch Universe, #4)",4.0
Mark Kurlansky,Salt: A World History,4.0
"Charlotte Brontë, A.S. Byatt, Μαρία Λαϊνά, Ignes Sodre",Villette,4.0
Neal Stephenson,Reamde,4.0
Terry Pratchett,"Soul Music (Discworld, #16; Death, #3)",4.0
Janet Evanovich,"Notorious Nineteen (Stephanie Plum, #19)",4.0
Frank Miller,"Sin City, Vol. 1: The Hard Goodbye (Sin City, #1)",4.0
Og Mandino,The Greatest Salesman in the World,4.0
Ian Fleming,"Casino Royale (James Bond, #1)",4.0
Paullina Simons,"The Bronze Horseman (The Bronze Horseman, #1)",4.0
Toni Morrison,Sula,4.0
A.G. Riddle,"The Atlantis Gene (The Origin Mystery, #1)",4.0
Philippa Gregory,"The Red Queen (The Plantagenet and Tudor Novels, #3)",4.0
Julie James,"Something About You (FBI/US Attorney, #1)",4.0
Dr. Seuss,Mr. Brown Can Moo! Can You?,4.0
"Stephen King, Peter Straub","Black House (The Talisman, #2)",4.0
"Neil Gaiman, Andy Kubert, Richard Isanove, Peter Sanderson",Marvel 1602,4.0
Vince Flynn,"Act of Treason (Mitch Rapp, #9)",4.0
John le Carré,The Spy Who Came In from the Cold,4.0
Jim Butcher,"Academ's Fury (Codex Alera, #2)",4.0
James Patterson,"When the Wind Blows (When the Wind Blows, #1)",4.0
"Paulo Coelho, Alan R. Clarke",The Pilgrimage,4.0
Lee Child,"The Hard Way (Jack Reacher, #10)",4.0
Sheila Burnford,The Incredible Journey,4.0
Geraldine Brooks,March,4.0
"Lee Child, Dick Hill","A Wanted Man (Jack Reacher, #17)",4.0
