authors,title,average_rating
Dean Koontz,"Saint Odd (Odd Thomas, #7)",4.0
Roald Dahl,The Wonderful Story of Henry Sugar and Six More,4.0
Charlaine Harris,"Real Murders (Aurora Teagarden, #1)",4.0
Patricia Cornwell,"Port Mortuary (Kay Scarpetta, #18)",4.0
"Dan Jurgens, Jerry Ordway, Louise Simonson, Roger Stern, Jon Bogdanove, Tom Grummett, Jackson Butch Guice, Brett Breeding, Rick Burchett, Doug Hazlewood, Dennis Janke, Denis Rodier",The Death of Superman,4.0
Steven Hall,The Raw Shark Texts,4.0
Rick Riordan,"The Hammer of Thor (Magnus Chase and the Gods of Asgard, #2)",4.0
Sonali Deraniyagala,Wave,4.0
"Margaret Weis, Tracy Hickman","Fire Sea (The Death Gate Cycle, #3)",4.0
Andrew Solomon,"Far from the Tree: Parents, Children, and the Search for Identity",4.0
"Barbara Park, Denise Brunkus","Junie B. Jones and the  Stupid Smelly Bus (Junie B. Jones, #1)",4.0
"Gabriel García Márquez, Gregory Rabassa",The Autumn of the Patriarch,4.0
Conn Iggulden,"Bones of the Hills (Conqueror, #3)",4.0
Oliver Sacks,Hallucinations,4.0
Karen Marie Moning,"Burned (Fever, #7)",4.0
Edgar Allan Poe,The Murders in the Rue Morgue,4.0
Guy Gavriel Kay,The Summer Tree (The Fionavar Tapestry #1),4.0
"Maud Hart Lovelace, Lois Lenski","Betsy-Tacy (Betsy-Tacy, #1)",4.0
Sara Zarr,Sweethearts,4.0
Lauren Groff,The Monsters of Templeton,4.0
Charlaine Harris,"Midnight Crossroad (Midnight, Texas, #1)",4.0
Diane Mott Davidson,"Catering to Nobody (A Goldy Bear Culinary Mystery, #1)",4.0
Julie Kagawa,"The Lost Prince (The Iron Fey: Call of the Forgotten, #1)",4.0
Kathy Reichs,"Devil Bones (Temperance Brennan, #11)",4.0
James  Jones,From Here to Eternity,4.0
Wayne W. Dyer,Change Your Thoughts - Change Your Life: Living the Wisdom of the Tao,4.0
Michael Moore,"Dude, Where's My Country?",3.0
Mario Puzo,The Last Don,4.0
Meg Cabot,"Ready or Not (All-American Girl, #2)",3.0
Gerda Weissmann Klein,All But My Life: A Memoir,4.0
"Grant Morrison, Frank Quitely","All-Star Superman, Vol. 2",4.0
"George R.R. Martin, Elio M. García Jr., Linda Antonsson",The World of Ice & Fire: The Untold History of Westeros and the Game of Thrones,4.0
Julia Quinn,"To Sir Phillip, With Love (Bridgertons, #5)",4.0
Nicole  Williams,"Lost & Found (Lost & Found, #1)",4.0
Margaret Peterson Haddix,"Among the Barons (Shadow Children, #4)",4.0
"Kimberly Brubaker Bradley, مرضیه ورشوساز",The War that Saved My Life (The War That Saved My Life #1),4.0
R.L. Stine,"Say Cheese and Die! (Goosebumps, #4)",4.0
Bernard Cornwell,"Sharpe's Tiger (Sharpe, #1)",4.0
Meg Cabot,Jinx,4.0
"Thomas Mann, Joachim Neugroschel",Death in Venice and Other Tales,4.0
Alan Bradley,"As Chimney Sweepers Come to Dust (Flavia de Luce, #7)",4.0
Zoë Heller,What Was She Thinking? [Notes on a Scandal],4.0
J.R. Ward,"The Beast (Black Dagger Brotherhood, #14)",4.0
Dorothea Benton Frank,"Sullivan's Island (Lowcountry Tales, #1)",4.0
"CLAMP, Anita Sengupta","Cardcaptor Sakura: Master of the Clow, Vol. 1 (Cardcaptor Sakura, #7)",4.0
G.P. Ching,"The Soulkeepers (The Soulkeepers, #1)",4.0
Michael Morpurgo,Private Peaceful,4.0
Rhys Bowen,"Her Royal Spyness (Her Royal Spyness Mysteries, #1)",4.0
Ilona Andrews,"Gunmetal Magic (Kate Daniels, #5.5)",4.0
Joe Abercrombie,"Half a War (Shattered Sea, #3)",4.0
Jennifer Probst,"The Marriage Mistake (Marriage to a Billionaire, #3)",4.0
Kelley Armstrong,"Darkest Powers Trilogy (Darkest Powers, #1-3)",4.0
Elizabeth Haydon,"Rhapsody: Child of Blood (Symphony of Ages, #1)",4.0
Erich Segal,Doctors,4.0
"Amin Maalouf, Russell Harris",Samarkand,4.0
J.D. Robb,"Indulgence in Death (In Death, #31)",4.0
NoViolet Bulawayo,We Need New Names,4.0
Jen Lancaster,Pretty in Plaid,4.0
Scott Cunningham,Wicca: A Guide for the Solitary Practitioner,4.0
"Arthur Miller, Christopher Bigsby",All My Sons,4.0
Cath Crowley,Graffiti Moon,4.0
John Steptoe,Mufaro's Beautiful Daughters: An African Tale,4.0
Lois McMaster Bujold,"Paladin of Souls (World of the Five Gods, #2)",4.0
Kurt Vonnegut Jr.,"God Bless You, Dr. Kevorkian",4.0
Molly Wizenberg,A Homemade Life: Stories and Recipes from My Kitchen Table,4.0
David Wiesner,The Three Pigs,4.0
Kimberly Derting,"Desires of the Dead (The Body Finder, #2)",4.0
"Peggy Parish, Barbara Siebel Thomas",Amelia Bedelia and the Surprise Shower,4.0
Cynthia Voigt,"Homecoming (Tillerman Cycle, #1)",4.0
Karen Marie Moning,"Spell of the Highlander (Highlander, #7)",4.0
"Margaret Weis, Tracy Hickman","The Hand of Chaos (The Death Gate Cycle, #5)",4.0
Harlan Coben,One False Move (Myron Bolitar #5),4.0
Roger Zelazny,The Guns of Avalon (The Chronicles of Amber #2),4.0
Katherine Paterson,The Great Gilly Hopkins,4.0
Clive Cussler,"Trojan Odyssey (Dirk Pitt, #17)",4.0
James Alexander Thom,Follow the River,4.0
"William Shakespeare, Barbara A. Mowat, Paul Werstine",Measure for Measure,4.0
"Owen  West, Dean Koontz",The Mask,4.0
Cristin Terrill,All Our Yesterdays,4.0
Kimberly Rae Miller,Coming Clean,4.0
Kathleen Winsor,Forever Amber ,4.0
John  Stephens,"The Emerald Atlas (The Books of Beginning, #1)",4.0
Zadie Smith,Swing Time,4.0
Yuna Kagesaki,"Chibi Vampire, Vol. 01",4.0
Nina LaCour,Everything Leads to You,4.0
Wendy Mass,Jeremy Fink and the Meaning of Life,4.0
Patricia Polacco,"Thank You, Mr. Falker",5.0
William Gibson,The Peripheral,4.0
Alice Munro,Too Much Happiness,4.0
"J. Lynn, Jennifer L. Armentrout","Tempting the Best Man (Gamble Brothers, #1)",4.0
C.S. Pacat,"Captive Prince: Volume Two (Captive Prince, #2)",5.0
William  Kennedy,Ironweed,4.0
Jonathan Kellerman,"Deception (Alex Delaware, #25)",4.0
Sarah J. Maas,"A Court of Wings and Ruin (A Court of Thorns and Roses, #3)",5.0
Derek Landy,"The Faceless Ones (Skulduggery Pleasant, #3)",4.0
Paul Theroux,The Great Railway Bazaar,4.0
Brad Thor,"Black List (Scot Harvath, #11)",4.0
"Warren Ellis, Darick Robertson","Transmetropolitan, Vol. 2: Lust for Life (Transmetropolitan, #2)",4.0
Charles Stross,"The Atrocity Archives (Laundry Files, #1)",4.0
Steve Martin,The Pleasure of My Company,4.0
C.J. Sansom,"Dark Fire (Matthew Shardlake, #2)",4.0
Christina Lauren,"Beautiful Beginning (Beautiful Bastard, #3.5)",4.0
Brian Jacques,"Outcast of Redwall (Redwall, #8)",4.0
Lloyd Jones,Mister Pip,4.0
Cate Tiernan,"Book of Shadows (Sweep, #1)",4.0
Anna Todd,"After We Fell (After, #3)",4.0
Laurie Fabiano,Elizabeth Street,4.0
Sarah J. Maas,"The Assassin and the Pirate Lord (Throne of Glass, #0.1)",4.0
"Søren Kierkegaard, Alastair Hannay",Fear and Trembling,4.0
Amelia Atwater-Rhodes,"Hawksong (The Kiesha'ra, #1)",4.0
Thor Heyerdahl,Kon-Tiki: Across The Pacific In A Raft,4.0
Mohsin Hamid,How to Get Filthy Rich in Rising Asia,4.0
"Albert Einstein, Nigel Calder, Robert W. Lawson",Relativity: The Special and the General Theory,4.0
Siobhan Vivian,The List,3.0
David James Duncan,The Brothers K,4.0
W. Bruce Cameron,"A Dog's Journey (A Dog's Purpose, #2)",4.0
"Timothy J. Keller, Kathy  Keller",The Meaning of Marriage: Facing the Complexities of Commitment with the Wisdom of God,4.0
"Grant Morrison, Frank Quitely, Philip Tan, Jonathan Glapion, Alex Sinclair",Batman & Robin: Batman Reborn,4.0
Matsuri Hino,"MeruPuri, Vol. 1 (MeruPuri, #1)",4.0
"F. Scott Fitzgerald, Matthew J. Bruccoli",The Short Stories,4.0
V.C. Andrews,"Dark Angel (Casteel, #2)",4.0
Timothy Zahn,"Specter of the Past (Star Wars: The Hand of Thrawn, #1)",4.0
Alessandra Torre,Black Lies,4.0
Laura Lippman,What the Dead Know,4.0
"Jay Crownover, Charlotte Connan de vries","Rome (Marked Men, #3)",4.0
"Laurence Sterne, Melvyn New","The Life and Opinions of Tristram Shandy, Gentleman",4.0
"Giles Andreae, Guy Parker-Rees",Giraffes Can't Dance,4.0
Susan Vreeland,The Passion of Artemisia,4.0
Louise L. Hay,Heal Your Body: The Mental Causes for Physical Illness and the Metaphysical Way to Overcome Them,4.0
"Mia Ikumi, Reiko Yoshida","Tokyo Mew Mew, Vol. 1 (Tokyo Mew Mew, #1)",4.0
Emily M. Danforth,The Miseducation of Cameron Post,4.0
"Neil Gaiman, P. Craig Russell",Coraline (Illustrated/Graphic Novel Edition),4.0
Diana Wynne Jones,"House of Many Ways (Howl's Moving Castle, #3)",4.0
Don Winslow,The Cartel,4.0
Sue Klebold,A Mother's Reckoning: Living in the Aftermath of Tragedy,4.0
Carl Hiaasen,"Skin Tight (Mick Stranahan, #1)",4.0
Ian Fleming,"Moonraker (James Bond, #3)",4.0
"John Locke, Peter Laslett, Raymond Geuss",Two Treatises of Government,4.0
Henry David Thoreau,Civil Disobedience and Other Essays,4.0
Louisa May Alcott,"Rose in Bloom (Eight Cousins, #2)",4.0
David  Arnold,Mosquitoland,4.0
Barbara Claypole White,The Perfect Son,4.0
Melina Marchetta,Looking for Alibrandi,4.0
Kristen Ashley,"Raid (Unfinished Hero, #3)",4.0
Darynda Jones,"Fifth Grave Past the Light (Charley Davidson, #5)",4.0
Wilbur Smith,"The Seventh Scroll (Ancient Egypt, #2)",4.0
Kody Keplinger,A Midsummer's Nightmare,4.0
Nick Cutter,The Troop,4.0
C.J. Sansom,"Revelation (Matthew Shardlake, #4)",4.0
"Pablo Neruda, Stephen Tapscott",100 Love Sonnets,4.0
Julia Quinn,"It's in His Kiss (Bridgertons, #7)",4.0
"J.K. Rowling, MinaLima","Short Stories from Hogwarts of Power, Politics and Pesky Poltergeists (Pottermore Presents, #2)",4.0
"Georg Wilhelm Friedrich Hegel, A.V. Miller, John Niemeyer Findlay",Phenomenology of Spirit,4.0
Kristen Ashley,"Fire Inside (Chaos, #2)",4.0
Peter F. Hamilton,"The Neutronium Alchemist (Night's Dawn, #2)",4.0
Gena Showalter,The Darkest Seduction (Lords of the Underworld #9),4.0
Victoria Aveyard,"King's Cage (Red Queen, #3)",4.0
Paul Auster,Invisible,4.0
Sarah Mlynowski,Ten Things We Did (and Probably Shouldn't Have),4.0
Moira Young,"Rebel Heart (Dust Lands, #2)",4.0
Paulette Jiles,News of the World,4.0
Brad Thor,"Blowback (Scot Harvath, #4)",4.0
Devdutt Pattanaik,Jaya: An Illustrated Retelling of the Mahabharata,4.0
Gail Tsukiyama,Women of the Silk,4.0
Anthony Hope,The Prisoner of Zenda,4.0
Amanda Hocking,"Flutter (My Blood Approves, #3)",4.0
Tammy Falkner,"Tall, Tatted and Tempting (The Reed Brothers, #1)",4.0
Paul Auster,Leviathan,4.0
David Baldacci,Saving Faith,4.0
R.A. Salvatore,"The Spine of the World (Forgotten Realms: Paths of Darkness, #2; Legend of Drizzt, #12)",4.0
R.L. Stine,"The Haunted Mask (Goosebumps, #11)",4.0
Douglas Preston,Tyrannosaur Canyon (Wyman Ford #1),4.0
J.P. Delaney,The Girl Before,4.0
Louis Sachar,Wayside School Gets A Little Stranger (Wayside School #3),4.0
Dan Simmons,Summer of Night,4.0
"Jim Butcher, Mark Powers, Ardian Syaf","The Dresden Files:  Storm Front, Volume 1-  The Gathering Storm",4.0
Carl Hiaasen,Tourist Season,4.0
Debbie Macomber,"204 Rosewood Lane (Cedar Cove, #2)",4.0
Karin Slaughter,"Unseen (Will Trent, #7)",4.0
Robert A. Heinlein,Double Star,4.0
Alex Kava,"A Perfect Evil (Maggie O'Dell, #1)",4.0
Anne Lamott,Help Thanks Wow: The Three Essential Prayers,4.0
Steven Pinker,The Better Angels of Our Nature: Why Violence Has Declined,4.0
"A.A. Milne, Ernest H. Shepard","When We Were Very Young (Winnie-the-Pooh, #3)",4.0
M.O. Walsh,My Sunshine Away,4.0
Nicole Krauss,Great House,3.0
Karin Slaughter,"The Kept Woman (Will Trent, #8)",4.0
Marie Force,"Maid for Love (Gansett Island Series, #1)",4.0
Francine Rivers,And the Shofar Blew,4.0
Orson Scott Card,"Prentice Alvin (Tales of Alvin Maker, #3)",4.0
Alexander McCall Smith,"44 Scotland Street (44 Scotland Street, #1)",4.0
Sandra Brown,Chill Factor,4.0
"Neil Gaiman, Mark Buckingham",Odd and the Frost Giants,4.0
Mark  Edwards,The Magpies,4.0
"Tayeb Salih, Denys Johnson-Davies",Season of Migration to the North,4.0
Doris Lessing,The Golden Notebook,4.0
Jeff Shaara,"The Last Full Measure (The Civil War Trilogy, #3)",4.0
Patrick O'Brian,"Post Captain (Aubrey/Maturin, #2)",4.0
Jessica Day George,"Dragon Flight (Dragon Slippers, #2)",4.0
Susan Coolidge,"What Katy Did (Carr Family, #1)",4.0
Robert McCloskey,Homer Price (A Puffin Book),4.0
Tamora Pierce,"Shatterglass (The Circle Opens, #4)",4.0
David Eddings,"The Belgariad, Vol. 1: Pawn of Prophecy / Queen of Sorcery / Magician's Gambit (The Belgariad, #1-3)",4.0
Philip G. Zimbardo,The Lucifer Effect: Understanding How Good People Turn Evil,4.0
Nancy Pickard,The Scent of Rain and Lightning,4.0
"Clive Cussler, Michael Pritchard","Pacific Vortex! (Dirk Pitt, #1)",4.0
Abbi Glines,"One More Chance (Rosemary Beach, #8; Chance, #2)",4.0
Kim Stanley Robinson,Aurora,4.0
J.D. Robb,"Purity in Death (In Death, #15)",4.0
Mary  Stewart,"The Hollow Hills (Arthurian Saga, #2)",4.0
Margaret Peterson Haddix,"Among the Brave (Shadow Children, #5)",4.0
"Rusty Young, Thomas McFadden","Marching Powder: A True Story of Friendship, Cocaine, and South America's Strangest Jail",4.0
Fuyumi Soryo,"Mars, Volume 01",4.0
Richard Feynman,Six Easy Pieces: Essentials of Physics By Its Most Brilliant Teacher,4.0
"Marv Wolfman, George Pérez",Crisis on Infinite Earths,4.0
John Hodgman,The Areas of My Expertise: An Almanac of Complete World Knowledge Compiled with Instructive Annotation and Arranged in Useful Order,4.0
J.K. Rowling,"Hogwarts: An Incomplete and Unreliable Guide (Pottermore Presents, #3)",4.0
"Astrid Lindgren, Patricia Crampton, Trina Schart Hyman","Ronia, the Robber's Daughter",4.0
Kathy Reichs,"Spider Bones (Temperance Brennan, #13)",4.0
Andrew Clements,No Talking,4.0
"Jo Nesbø, Neil Smith","Blood on Snow (Blood on Snow, #1)",4.0
Elisabeth Naughton,"Wait for Me (Against All Odds, #1)",4.0
Tan Twan Eng,The Garden of Evening Mists,4.0
Natasha Preston,"The Cellar (The Cellar, #1)",4.0
Arina Tanemura,"The Gentlemen's Alliance †, Vol. 1",4.0
Alice Clayton,"Rusty Nailed (Cocktail, #2)",4.0
Christine Feehan,"Dark Guardian (Dark, #9)",4.0
Frank E. Peretti,Prophet,4.0
Danielle  Paige,"The Wicked Will Rise (Dorothy Must Die, #2)",4.0
Christine Feehan,"Dark Fire (Dark, #6)",4.0
Claudia Rankine,Citizen: An American Lyric,4.0
P.G. Wodehouse,"Carry on, Jeeves (Jeeves, #3)",4.0
"Sarah Prineas, Antonio Javier Caparo","The Magic Thief (Magic Thief, #1)",4.0
Rosalind Miles,"I, Elizabeth",4.0
Marian Keyes,The Woman Who Stole My Life,4.0
Guy Delisle,Pyongyang: A Journey in North Korea,4.0
Ken Follett,Night Over Water,4.0
Courtney Maum,I Am Having So Much Fun Here Without You,3.0
Cecily von Ziegesar,"All I Want is Everything (Gossip Girl, #3)",4.0
Sarah Andersen,"Adulthood Is a Myth (Sarah's Scribbles, #1)",4.0
R. Scott Bakker,"The Darkness That Comes Before (The Prince of Nothing, #1)",4.0
Kristin Kimball,"The Dirty Life: On Farming, Food, and Love",4.0
Jonathan Maberry,"Dust & Decay (Rot & Ruin, #2)",4.0
Melissa Landers,"Alienated (Alienated, #1)",4.0
Laura Ruby,Bone Gap,4.0
Adriana Trigiani,"Big Cherry Holler (Big Stone Gap, #2)",4.0
Marcus Samuelsson,"Yes, Chef",4.0
Meg Cabot,Teen Idol,4.0
Chimamanda Ngozi Adichie,The Thing Around Your Neck,4.0
Stephanie Garber,Caraval,4.0
James Frey,Bright Shiny Morning,4.0
Kate Chopin,The Story of an Hour,4.0
John Updike,Rabbit Is Rich (Rabbit Angstrom #3),4.0
Anna Quindlen,"Lots of Candles, Plenty of Cake",4.0
Cheryl Rainfield,Scars,4.0
Mary Kay Andrews,The Fixer Upper,4.0
Rick Atkinson,"An Army at Dawn: The War in North Africa, 1942-1943 (World War II Liberation Trilogy, #1)",4.0
Sandra Brown,Ricochet,4.0
Fannie Flagg,Can't Wait to Get to Heaven,4.0
Jo Walton,Among Others,4.0
J.D. Robb,"Seduction in Death (In Death, #13)",4.0
James M. Cain,Double Indemnity,4.0
Sherrilyn Kenyon,"Upon the Midnight Clear (Dark-Hunter #12, Dream-Hunter #2)",4.0
R.A. Salvatore,"Sea of Swords (Forgotten Realms: Paths of Darkness, #4; Legend of Drizzt, #13)",4.0
"Tom Sniegoski, Jeff Smith, Thomas E. Sniegoski, Steve Hamaker","Bone: Quest for the Spark, Vol. 1",4.0
Dorothea Benton Frank,The Last Original Wife,4.0
Sherrilyn Kenyon,"No Mercy (Dark-Hunter #18, Were-Hunter, #5)",4.0
Scott  Hawkins,The Library at Mount Char,4.0
Chris d'Lacey,"Fire Star (The Last Dragon Chronicles, #3)",4.0
Jennifer L. Holm,Turtle in Paradise,4.0
Lois McMaster Bujold,"The Vor Game (Vorkosigan Saga, #6)",4.0
Lauren Beukes,Broken Monsters,4.0
"Sylvia Plath, Karen V. Kukil",The Unabridged Journals of Sylvia Plath,4.0
David Foster Wallace,"This Is Water: Some Thoughts, Delivered on a Significant Occasion, about Living a Compassionate Life",5.0
Kelley Armstrong,"Haunted (Women of the Otherworld, #5)",4.0
Jill Conner Browne,The Sweet Potato Queens' Book of Love,4.0
Tamora Pierce,"Mastiff (Beka Cooper, #3)",4.0
Laurell K. Hamilton,"Divine Misdemeanors (Merry Gentry, #8)",4.0
Chelsea Cain,"Sweetheart (Archie Sheridan & Gretchen Lowell, #2)",4.0
William Gibson,"All Tomorrow's Parties (Bridge, #3)",4.0
Hannu Rajaniemi,"The Quantum Thief (Jean le Flambeur, #1)",4.0
John Sandford,"Shock Wave (Virgil Flowers, #5)",4.0
Ludwig Wittgenstein,Tractatus Logico-Philosophicus,4.0
Agatha Christie,"Lord Edgware Dies (Hercule Poirot, #9)",4.0
"Jeph Loeb, Jim Lee, Scott Williams","Batman: Hush, Vol. 2",4.0
Spencer Quinn,Dog on It (A Chet and Bernie Mystery #1),4.0
Mary Kay Andrews,Spring Fever,4.0
Dr. Seuss,And to Think That I Saw it on Mulberry Street,4.0
Doris Kearns Goodwin,"The Bully Pulpit: Theodore Roosevelt, William Howard Taft, and the Golden Age of Journalism",4.0
Brandon Mull,"Chasing the Prophecy (Beyonders, #3)",4.0
"P.C. Cast, Kristin Cast","Dragon's Oath (House of Night Novellas, #1)",4.0
Kalayna Price,"Grave Witch (Alex Craft, #1)",4.0
Agatha Christie,"Sleeping Murder (Miss Marple, #13)",4.0
"Edith Wharton, Mary Gordon",Ethan Frome and Other Short Fiction,4.0
Sarah J. Maas,"The Assassin and the Desert (Throne of Glass, #0.3)",4.0
"Friedrich Nietzsche, Walter Kaufmann, R.J. Hollingdale",On the Genealogy of Morals/Ecce Homo,4.0
Steven Callahan,Adrift: Seventy-Six Days Lost at Sea,4.0
Judith McNaught,"Once and Always (Sequels, #1)",4.0
James Rollins,"Bloodline (Sigma Force, #8)",4.0
Bernard Cornwell,"Death of Kings (The Saxon Stories, #6)",4.0
Laurence Rees,Auschwitz,4.0
Slavomir Rawicz,The Long Walk: The True Story of a Trek to Freedom,4.0
Nora Roberts,Three Fates,4.0
Alexandra Bracken,"Passenger (Passenger, #1)",4.0
"J.D. Robb, Susan Ericksen","Born in Death (In Death, #23)",4.0
Chris Bohjalian,"Close Your Eyes, Hold Hands",4.0
Agatha Christie,"A Pocket Full of Rye (Miss Marple, #7)",4.0
Iain M. Banks,The Algebraist,4.0
Margaret Atwood,Stone Mattress: Nine Tales,4.0
"Morgan Rhodes, Michelle Rowen","Rebel Spring (Falling Kingdoms, #2)",4.0
"James Patterson, Marshall Karp","NYPD Red 2 (NYPD Red, #2)",4.0
James A. Michener,Chesapeake,4.0
Steve Martini,The List,4.0
Walter Mosley,"Devil in a Blue Dress (Easy Rawlins, #1)",4.0
Mary Elizabeth Braddon,Lady Audley's Secret,4.0
"José Saramago, Margaret Jull Costa",All the Names,4.0
Adriana Trigiani,"Lucia, Lucia",4.0
Jodi Lynn Anderson,Tiger Lily,4.0
"Karen Kingsbury, Gary Smalley","Return (Redemption, #3)",4.0
Philip Pullman,"The Ruby in the Smoke (Sally Lockhart, #1)",4.0
Amanda Foreman,Georgiana: Duchess of Devonshire,4.0
A.C. Gaughen,"Scarlet (Scarlet, #1)",4.0
Miranda Kenneally,Stealing Parker,4.0
"Bill Willingham, Mark Buckingham, Steve Leialoha, Tony Akins, Jimmy Palmiotti","Fables, Vol. 5: The Mean Seasons",4.0
"Robert Shea, Robert Anton Wilson",The Illuminatus! Trilogy,4.0
Alexander Gordon Smith,"Lockdown (Escape from Furnace, #1)",4.0
"Michael Chabon, Jay Ryan",The Final Solution,3.0
Nancy Thayer,Beachcombers,4.0
"John Layman, Rob Guillory","Chew, Vol. 2: International Flavor",4.0
Poppy Z. Brite,Lost Souls,4.0
Alan W. Watts,The Way of Zen,4.0
Ramez Naam,"Nexus (Nexus, #1)",4.0
Veronica Roth,"The Traitor (Divergent, #0.4)",4.0
Colm Tóibín,Nora Webster,4.0
Jamie McGuire,"Requiem (Providence, #2)",4.0
Steve Berry,"The Emperor's Tomb (Cotton Malone, #6)",4.0
Lisa Gardner,"Fear Nothing (Detective D.D. Warren, #7)",4.0
"Dorie Greenspan, Alan    Richardson",Baking: From My Home to Yours,4.0
Jane Green,Promises to Keep,4.0
Kristen Ashley,"For You (The 'Burg, #1)",4.0
"Aya Nakahara, Pookie Rolf","Love★Com, Vol. 1",4.0
Agatha Christie,"Elephants Can Remember (Hercule Poirot, #37)",4.0
Belle Aurora,"Friend-Zoned (Friend-Zoned, #1)",4.0
"Heidi Murkoff, Sharon Mazel, Heidi Murkoff, Arlene Eisenberg, Sandee Hathaway, Mark D. Widome",What to Expect the First Year (What to Expect),4.0
Danielle Steel,The Gift,4.0
Kristin Levine,The Lions of Little Rock,4.0
Phillip C. McGraw,Self Matters: Creating Your Life from the Inside Out,4.0
Amanda Hocking,"Hollowland (The Hollows, #1)",4.0
Hidekaz Himaruya,"Hetalia: Axis Powers, Vol. 1 (Hetalia: Axis Powers, #1)",4.0
Gail Carriger,"Timeless (Parasol Protectorate, #5)",4.0
J.A. Redmerski,"Killing Sarai (In the Company of Killers, #1)",4.0
Cecelia Ahern,The Time of My Life,4.0
"A.A. Milne, Ernest H. Shepard","Now We Are Six (Winnie-the-Pooh, #4)",4.0
L.J. Smith,"The Captive Part II / The Power (The Secret Circle, #2-3)",4.0
Mary Kay Andrews,Ladies' Night,4.0
Jane Green,Family Pictures ,4.0
Lara Adrian,"Taken by Midnight (Midnight Breed, #8)",4.0
Amy Harmon,"The Law of Moses (The Law of Moses, #1)",4.0
Amy Gentry,Good as Gone,4.0
Nora Roberts,Holding the Dream (Dream Trilogy #2),4.0
Tijan,"Fallen Crest Family (Fallen Crest High, #2)",4.0
Joshilyn Jackson,A Grown-Up Kind of Pretty,4.0
Miranda Hart,Is It Just Me?,4.0
Kent Haruf,"Eventide (Plainsong, #2)",4.0
"Tim Hamilton, Ray Bradbury",Fahrenheit 451: The Authorized Adaptation,4.0
"Hiroshi Sakurazaka, 桜坂洋, Alexander O. Smith, Joseph Reeder",All You Need Is Kill,4.0
Elizabeth George Speare,The Bronze Bow,4.0
Alain de Botton,On Love,4.0
Jonathan Harr,A Civil Action,4.0
Allen Say,Grandfather's Journey,4.0
Mary Kay Andrews,"Savannah Blues (Weezie and Bebe Mysteries, #1)",4.0
James Rollins,Excavation,4.0
"René Descartes, Donald A. Cress",Discourse on Method,4.0
Matthew Reilly,"Scarecrow (Shane Schofield, #3)",4.0
Kiersten White,"Endlessly (Paranormalcy, #3)",4.0
Ella Carey,The House by the Lake,4.0
Thich Nhat Hanh,"Living Buddha, Living Christ",4.0
Ursula K. Le Guin,The Earthsea Trilogy,4.0
Jessica Park,"Left Drowning (Left Drowning, #1)",4.0
"Philip C. Stead, Erin E. Stead",A Sick Day for Amos McGee,4.0
Smith Henderson,Fourth of July Creek,4.0
Lisa Jackson,"Absolute Fear (New Orleans, #4)",4.0
Greg Iles,True Evil,4.0
"Erskine Caldwell, Lewis Nordan",Tobacco Road (Brown Thrasher Books),4.0
Kate Summerscale,The Suspicions of Mr. Whicher: A Shocking Murder and the Undoing of a Great Victorian Detective,3.0
Loretta Chase,"Lord of Scoundrels (Scoundrels, #3)",4.0
L. Frank Baum,"Ozma of Oz (Oz, #3)",4.0
David McCullough,The Johnstown Flood,4.0
Glenn Beck,The Christmas Sweater,4.0
Rachel Renée Russell,"Tales from a Not-So-Happy Heartbreaker (Dork Diaries, #6)",4.0
James Rollins,Deep Fathom,4.0
Nelson DeMille,The Gate House,4.0
"J. Lynn, Jennifer L. Armentrout","Stay with Me (Wait for You, #3)",4.0
Sylvia Day,Seven Years to Sin,4.0
"Larry Bird, Earvin Johnson, Jackie MacMullan",When the Game Was Ours,4.0
Agatha Christie,"Nemesis (Miss Marple, #12)",4.0
Tony Hillerman,"The Blessing Way (Leaphorn & Chee, #1)",4.0
Jane Green,Another Piece of My Heart,4.0
Mo Willems,The Pigeon Wants a Puppy!,4.0
David  Brooks,The Road to Character,4.0
"Gabriel García Márquez, Edith Grossman",The General in His Labyrinth,4.0
Cammie McGovern,Say What You Will,4.0
Tess Gerritsen,"Die Again (Rizzoli & Isles, #11)",4.0
H.M. Ward,"Damaged 2 (Damaged, #2)",4.0
Sandra Brown,The Witness,4.0
Katy Evans,"Manwhore (Manwhore, #1)",4.0
Enid Blyton,The Faraway Tree Stories (The Faraway Tree #1-3),4.0
Misty Bernall,She Said Yes: The Unlikely Martyrdom of Cassie Bernall,4.0
Evelyn Waugh,Scoop,4.0
Rita Golden Gelman,Tales of a Female Nomad: Living at Large in the World,4.0
Lorrie Moore,Birds of America,4.0
Lauren Blakely,Big Rock,4.0
Kendare Blake,"Three Dark Crowns (Three Dark Crowns, #1)",4.0
Elizabeth Bard,"Lunch in Paris: A Love Story, with Recipes",4.0
John Jakes,"Love and War (North and South, #2)",4.0
Aprilynne Pike,"Destined (Wings, #4)",4.0
"David Foster Wallace, Michael Pietsch",The Pale King,4.0
"Confucius, D.C. Lau",The Analects,4.0
"Pamela Des Barres, Dave Navarro",I'm with the Band: Confessions of a Groupie,4.0
Mariana Zapata,Under Locke,4.0
"Giuseppe Tomasi di Lampedusa, Archibald Colquhoun",The Leopard,4.0
"Paul Jenkins, Andy Kubert, Richard Isanove, Joe Quesada, Bill Jemas",Wolverine: Origin,4.0
V.C. Andrews,"Dawn (Cutler, #1)",4.0
"Patricia Briggs, Eileen Wilks, Karen Chance, Sunny","On the Prowl (Alpha & Omega, #0.5)",4.0
John Sandford,Silent Prey (Lucas Davenport #4),4.0
Sara Douglass,"The Wayfarer Redemption (Wayfarer Redemption, #1)",4.0
Adam Gidwitz,"A Tale Dark & Grimm (A Tale Dark & Grimm, #1)",4.0
Trudi Canavan,"The Ambassador's Mission (Traitor Spy Trilogy, #1)",4.0
Philip Roth,Everyman,4.0
L.J. Smith,"Dark Reunion (The Vampire Diaries, #4)",4.0
Luke Rhinehart,The Dice Man,4.0
"Yana Toboso, Tomo Kimura","Black Butler, Vol. 2 (Black Butler, #2)",4.0
Bret Easton Ellis,Imperial Bedrooms ,3.0
"Krista Ritchie, Becca Ritchie","Addicted to You (Addicted, #1)",4.0
Gayle Forman,"Just One Night (Just One Day, #2.5)",4.0
Amazon,Kindle User's Guide,4.0
"Tsugumi Ohba, Takeshi Obata","Death Note, Vol. 4: Love (Death Note, #4)",4.0
Josephine Tey,"The Daughter of Time (Inspector Alan Grant, #5)",4.0
Daniel Silva,"Prince of Fire (Gabriel Allon, #5)",4.0
"Milan Kundera, Linda Asher",Slowness,4.0
Brian  McClellan,"The Autumn Republic (Powder Mage, #3)",4.0
Anaïs Nin,Delta of Venus,4.0
Vernor Vinge,Rainbows End,4.0
Kristen Callihan,"The Friend Zone (Game On, #2)",4.0
Michael J. Sullivan,"The Rose and the Thorn (The Riyria Chronicles, #2)",4.0
"Sergei Lukyanenko, Andrew Bromfield",Twilight Watch (Watch #3),4.0
Kelley Armstrong,"Frostbitten (Women of the Otherworld, #10)",4.0
J.R. Ward,"Blood Kiss (Black Dagger Legacy, #1)",4.0
"Sandra Brown, Stephen Lang",Low Pressure,4.0
Raymond E. Feist,"Talon of the Silver Hawk (Conclave of Shadows, #1)",4.0
Steve Berry,"The Charlemagne Pursuit (Cotton Malone, #4)",4.0
John Steinbeck,The Moon Is Down,4.0
Mark Mathabane,Kaffir Boy: An Autobiography,4.0
Anne Tyler,The Beginner's Goodbye,4.0
T.S. Eliot,The Love Song of J. Alfred Prufrock and Other Poems,4.0
Gene Stratton-Porter,"A Girl of the Limberlost (Limberlost, #2)",4.0
Kim Harrison,"The Witch With No Name (The Hollows, #13)",4.0
